{
  "$schema": "https://json-schema.org/draft/2020-12/schema",
  "$id": "https://raw.githubusercontent.com/skifahrer/schemas/master/schema/v1/sign.schema.json",
  "title": "traffic sign v1, one country",
  "description": "One country's version of a sign in skifahrer/traffic-signs: `signs/<category>/<sign>/<country>/<sign>-<country>.json`. Its national code, its image and where both came from. The sign's names are in the names file next to the country folders (sign-names.schema.json).",
  "type": "object",
  "required": ["sign", "category", "country", "code"],
  "properties": {
    "$schema": { "type": "string", "description": "The schema the file follows: this schema's $id." },
    "sign": { "$ref": "#/$defs/slug", "description": "The sign's folder, the same as in the path." },
    "category": { "$ref": "#/$defs/category", "description": "The category's folder, the same as in the path." },
    "country": { "$ref": "#/$defs/country", "description": "The country's folder, the same as in the path." },
    "code": {
      "type": "string",
      "minLength": 1,
      "description": "The sign's number in the country's own catalogue, as written there: `101`, `A 1a`, `W1-1`, `Zeichen 101` without the word."
    },
    "image": {
      "$ref": "#/$defs/image",
      "description": "The current image. Absent until it is downloaded, and after the sign left its source page (then `valid_until` is set and the image is in `archived`)."
    },
    "valid_until": {
      "$ref": "#/$defs/year",
      "description": "The sign left its source page: the last year it was known to be in use. Absent while it is current."
    },
    "archived": {
      "type": "array",
      "minItems": 1,
      "items": { "$ref": "#/$defs/archivedImage" },
      "description": "Earlier images, oldest first. Absent when there are none."
    },
    "source": { "$ref": "#/$defs/source" }
  },
  "$defs": {
    "slug": {
      "type": "string",
      "pattern": "^[a-z0-9]+(-[a-z0-9]+)*$",
      "description": "English, lowercase, words joined by single hyphens: `bend-left`, `speed-limit-50`, `maximum-weight-3-5t`."
    },
    "category": {
      "enum": ["warning", "regulatory", "information", "additional-panel", "traffic-device", "traffic-signal"],
      "description": "Closed: a value outside the list makes the file unreadable."
    },
    "country": {
      "type": "string",
      "pattern": "^[a-z]{2}(-[a-z0-9]{1,3})?$",
      "description": "ISO 3166-1 alpha-2, lowercase (`sk`, `us`), or ISO 3166-2 for a region of a country (`us-ca`)."
    },
    "year": { "type": "integer", "minimum": 1900, "maximum": 2999 },
    "sha1": { "type": "string", "pattern": "^[0-9a-f]{40}$", "description": "Lowercase hex, as Wikimedia Commons reports it." },
    "imageFile": {
      "type": "string",
      "pattern": "^[a-z0-9]+(-[a-z0-9]+)*\\.(svg|png|jpg|jpeg|gif|webp|tif|tiff)$",
      "description": "A file in the country's folder: `<sign>-<country>.<ext>`, or `<sign>-<country>-archived-<year>[-<n>].<ext>` for an archived one."
    },
    "imageInfo": {
      "type": "object",
      "properties": {
        "sha1": { "$ref": "#/$defs/sha1", "description": "Of the file's bytes, so a sync downloads it again only when Commons has a new version." },
        "source": { "type": "string", "format": "uri", "description": "The file's description page on Wikimedia Commons." },
        "author": { "type": ["string", "null"], "description": "As Commons names it; null when it names none." },
        "license": { "type": ["string", "null"], "description": "Short name: `Public domain`, `CC BY-SA 4.0`, `OGL v1.0`; null when Commons names none." },
        "license_url": { "type": ["string", "null"], "description": "The licence's text; null when it has no page." }
      }
    },
    "image": {
      "allOf": [{ "$ref": "#/$defs/imageInfo" }],
      "type": "object",
      "required": ["file", "sha1", "source", "author", "license", "license_url"],
      "properties": {
        "file": { "$ref": "#/$defs/imageFile" }
      }
    },
    "archivedImage": {
      "allOf": [{ "$ref": "#/$defs/imageInfo" }],
      "type": "object",
      "required": ["file", "valid_until"],
      "properties": {
        "file": {
          "anyOf": [{ "$ref": "#/$defs/imageFile" }, { "type": "null" }],
          "description": "The renamed file; null when there was none on disk to keep."
        },
        "valid_until": { "$ref": "#/$defs/year", "description": "The last year the image was known to be valid: when the sync noticed it had gone." }
      }
    },
    "source": {
      "type": "object",
      "description": "Where the sign was read.",
      "required": ["pipeline", "page", "file"],
      "properties": {
        "pipeline": {
          "type": "string",
          "pattern": "^[a-z]{2}(-[a-z0-9]{1,3})?-[a-z0-9]+(-[a-z0-9]+)*$",
          "description": "`<country>-<source>`: `sk-wikipedia`, `us-ca-wikipedia`."
        },
        "page": { "type": "string", "format": "uri", "description": "The page that lists the sign." },
        "file": { "type": "string", "minLength": 1, "description": "The image's name on that page, as the page writes it." }
      }
    }
  }
}
